{
  "name": "api",
  "version": "1.0.0",
  "description": "Framework-agnostic HTTP route handlers. Entry point for all client requests.",
  "files": ["api.handlers.ts"],
  "exports": {
    "route": "(req: ApiRequest) => ApiResponse — main router, dispatches all requests",
    "handleLogin": "(req: ApiRequest) => ApiResponse",
    "handleLogout": "(req: ApiRequest) => ApiResponse",
    "handleMe": "(req: ApiRequest) => ApiResponse",
    "handleCreateTask": "(req: ApiRequest) => ApiResponse",
    "handleUpdateTask": "(req: ApiRequest) => ApiResponse",
    "handleAssignTask": "(req: ApiRequest) => ApiResponse",
    "handleCompleteTask": "(req: ApiRequest) => ApiResponse",
    "handleDeleteTask": "(req: ApiRequest) => ApiResponse",
    "handleGetTask": "(req: ApiRequest) => ApiResponse",
    "handleGetProjectTasks": "(req: ApiRequest) => ApiResponse",
    "handleGetMyTasks": "(req: ApiRequest) => ApiResponse",
    "handleGetNotifications": "(req: ApiRequest) => ApiResponse",
    "handleMarkNotificationRead": "(req: ApiRequest) => ApiResponse"
  },
  "imports": {
    "auth": ["login", "logout", "getCurrentUser"],
    "tasks": ["createTask", "updateTask", "assignTask", "completeTask", "deleteTask", "getTask", "getProjectTasks", "getMyTasks"],
    "notifications": ["getNotifications", "markAsRead"]
  },
  "types": {
    "ApiRequest": "{ method, path, headers, body?, params?, query? }",
    "ApiResponse": "{ status: number; body: unknown }"
  },
  "env": [],
  "status": "stable",
  "lastModified": "2026-04-14"
}
