{
  "name": "tasks",
  "version": "1.0.0",
  "description": "Task CRUD, assignment, and completion. Notifies users on assignment and status changes.",
  "files": ["tasks.service.ts"],
  "exports": {
    "createTask": "(token: string, input: CreateTaskInput) => TaskWithAssignee",
    "updateTask": "(token: string, taskId: string, input: UpdateTaskInput) => TaskWithAssignee",
    "assignTask": "(token: string, taskId: string, assigneeId: string) => TaskWithAssignee",
    "completeTask": "(token: string, taskId: string) => TaskWithAssignee",
    "deleteTask": "(token: string, taskId: string) => void — requires admin",
    "getTask": "(token: string, taskId: string) => TaskWithAssignee",
    "getProjectTasks": "(token: string, projectId: string) => TaskWithAssignee[]",
    "getMyTasks": "(token: string) => TaskWithAssignee[]"
  },
  "imports": {
    "database": ["db.tasks.findById", "db.tasks.findByProject", "db.tasks.findByAssignee", "db.tasks.save", "db.tasks.delete"],
    "auth": ["requireAuth", "requireRole", "getUserById"],
    "notifications": ["sendAlert"]
  },
  "types": {
    "CreateTaskInput": "{ title, description?, priority?: TaskPriority, assigneeId?, projectId, dueDate? }",
    "UpdateTaskInput": "{ title?, description?, priority?, status?: TaskStatus, assigneeId?, dueDate? }",
    "TaskWithAssignee": "Task & { assignee?: { id, name, email } }"
  },
  "env": [],
  "status": "stable",
  "lastModified": "2026-04-14"
}
